pmcid,title,ground_truth_report,data_source,has_numeric_values,ai_generated_advice
PMC13333146,"Severe Bradycardia, Renal Failure, Atrioventricular Nodal Blockade, Shock, and Hyperkalemia (BRASH) Syndrome Successfully Managed With Transvenous Pacing and Continuous Renal Replacement Therapy.","PMC13333146 Case Report.
Title: Severe Bradycardia, Renal Failure, Atrioventricular Nodal Blockade, Shock, and Hyperkalemia (BRASH) Syndrome Successfully Managed With Transvenous Pacing and Continuous Renal Replacement Therapy.

Clinical Summary (from published abstract):
BRASH (Bradycardia, Renal failure, Atrioventricular nodal blockade, Shock, and Hyperkalemia) syndrome is a life-threatening clinical syndrome characterized by a vicious cycle in which hyperkalemia and AV nodal blocking medications synergistically produce profound bradycardia and hemodynamic instability. A 71-year-old male with stage IIIB chronic kidney disease (CKD), heart failure with improved ejection fraction, and coronary artery disease status post coronary artery bypass grafting, on carvedilol, losartan, and torsemide, was brought to the emergency room from a rehabilitation facility for a syncopal event and unresponsiveness. He had been recently hospitalized for multifocal pneumonia and respiratory syncytial virus infection, with suspected volume depletion and ongoing AV nodal blockade contributing to the development of BRASH syndrome. He was in respiratory distress, profound shock, and bradycardia with a heart rate of 30 BPM. Labs revealed severe acute kidney injury (creatinine 6.2 mg/dL), hyperkalemia (6.9 mmol/L), and metabolic acidosis (pH 7.19). Chest radiograph demonstrated pulmonary edema. His condition rapidly progressed to airway compromise requiring intubation, cardiogenic shock requiring vasopressors, and refractory bradycardia necessitating transvenous pacing after failure of atropine, dopamine, and transcutaneous pacing. He was admitted to the intensive care unit and promptly initiated on continuous renal replacement therapy (CRRT), resulting in correction of electrolyte and acid-base abnormalities with subsequent resolution of severe bradycardia, allowing discontinuation of transvenous pacing. Infectious workup remained negative, and echocardiography demonstrated preserved left ventricular systolic function. Following stabilization, he was successfully extubated and weaned off CRRT. His subsequent hospital course was complicated by recurrent oliguric renal failure requiring initiation of intermittent hemodialysis. Upon discharge, he remained hemodynamically stable with improved mental status and was planned for long-term hemodialysis and inpatient rehabilitation. The synergistic interaction of hyperkalemia and AV nodal blockade is the central pathophysiologic mechanism underlying BRASH syndrome. Common triggers include hypovolemia and medications that promote AV nodal blockade or hyperkalemia in vulnerable patients with advanced age, CKD, and heart failure. The resulting profound bradycardia further reduces cardiac output, worsening renal perfusion and perpetuating hemodynamic instability. Prognosis depends largely on early recognition and prompt intervention. This case highlights a severe presentation of BRASH syndrome in which timely initiation of CRRT corrected the underlying metabolic derangements, and transvenous pacing provided temporary hemodynamic support, ultimately leading to clinical recovery.",abstract,True,
PMC13333155,Primary Small Cell Carcinoma of the Liver Presenting With Acute Liver Failure.,"PMC13333155 Case Report.
Title: Primary Small Cell Carcinoma of the Liver Presenting With Acute Liver Failure.

Clinical Summary (from published abstract):
Primary small cell carcinoma of the liver is an exceptionally rare malignancy and must be distinguished from metastatic pulmonary small cell carcinoma by excluding a pulmonary primary. We report a 55-year-old man with suspected alcohol-related cirrhosis and diabetes who presented for elective lithotripsy and was found to have jaundice, hepatomegaly, and acute liver dysfunction. Laboratory evaluation demonstrated marked hyperbilirubinemia and transaminitis with normal alpha-fetoprotein. Imaging revealed interval hepatomegaly with diffuse hepatic involvement compared to CT performed three months earlier, which had shown no focal lesions. Liver biopsy demonstrated small cell carcinoma with immunohistochemical positivity for CD56 and synaptophysin and negative TTF-1 staining. Chest radiograph showed no evidence of pulmonary malignancy, supporting a primary hepatic origin. The patient developed progressive liver failure, hypoxic respiratory failure, and shock and died seven days after admission. A review of 31 previously reported cases demonstrates a predominance in middle-aged males, frequent association with cirrhosis or diabetes, common presentation with abdominal pain and jaundice, and typically normal tumor markers. These findings were consistent with those observed in our patient. Reported survivors most often received combined surgical resection and platinum-based chemotherapy. This case highlights the rare yet aggressive course of primary small cell carcinoma of the liver and its potential to cause rapid liver failure.",abstract,False,
PMC13332906,Immunoglobulin A nephropathy with superimposed minimal change disease complicated by acute kidney injury requiring temporary hemodialysis.,"PMC13332906 Case Report.
Title: Immunoglobulin A nephropathy with superimposed minimal change disease complicated by acute kidney injury requiring temporary hemodialysis.

Clinical Summary (from published abstract):
Immunoglobulin A (IgA) nephropathy (IgAN) with superimposed minimal change disease (MCD) is a rare but increasingly recognized clinicopathological phenotype that is generally associated with a favorable renal prognosis. We present a case of IgAN with MCD complicated by severe acute kidney injury (AKI) during the clinical course and requiring temporary renal replacement therapy. A 38-year-old man presented with acute nephrotic syndrome. Renal biopsy showed mesangial IgA deposition, and anti-galactose-deficient IgA1 antibody (KM55) staining demonstrated co-localization with IgA deposits, supporting the diagnosis of IgAN with superimposed MCD. Electron microscopy revealed foot process effacement, leading to a diagnosis of IgAN with MCD. High-dose prednisolone therapy was initiated; however, the patient subsequently developed severe AKI requiring hemodialysis (HD). Concurrent treatment with cyclosporine A and steroid pulse therapy was administered, ultimately allowing successful discontinuation of HD. This rare case was diagnosed as IgAN with MCD based on mesangial IgA deposition supported by KM55 staining and characteristic electron microscopic findings, and this case demonstrates that severe AKI requiring temporary HD may occur during the clinical course of IgAN with MCD. Although IgAN with MCD has been increasingly recognized, reports of cases complicated by severe AKI requiring HD remain limited in the literature. This patient showed subsequent improvements in renal function and proteinuria, suggesting that this condition may be reversible. These findings highlight the importance of careful clinical management with attention to the potential risk of AKI even in patients with IgAN with MCD.",abstract,False,
PMC13332979,Update on Genetic Chorea.,"PMC13332979 Case Report.
Title: Update on Genetic Chorea.

Clinical Summary (from published abstract):
Chorea is a symptom of numerous pathophysiologically and clinically heterogeneous genetic conditions. A number of developments have been made in this field over the last years linked to improved genomic testing, large cohort collaborations and improved understanding of the molecular mechanisms. This review aims to provide an update on the new genetic conditions and phenotypes linked to chorea disorders, their modification factors and pathophysiological background. Several novel genetic conditions have been linked to chorea over the last 3 years, including mutations in FTH1, NAA60, ACBD6 or TOR1AIP2. Also, novel phenotypes have been established and linked to chorea, such as Adult-onset Neurodegeneration in Nucleotide Excision Repair Disorder (NERD-ND). Major advances have been made in understanding of the pathophysiological role of somatic instability in HD. Striatal pallidal neurons (SPNs) with 150–500 + CAG repeats seem to lose positive and then negative features of neuronal identity, de-repress senescence/apoptosis genes, ultimately leading to cell death. Improved recognition of the genetic background of chorea leads to more effective diagnostic processes, better prognostication and improved personalized treatment. The findings on somatic instability in HD suggest that neurodegeneration in HD is an asynchronous DNA process for >95% of a neuron's life, with majority of neurons in all disease stages having a HTT gene which is not biologically harmful. This has potential major therapeutic implications not only in HD but also in other neurological repeat expansion disorders.",abstract,True,
PMC13332986,Single Port Robotic Surgery in Benign Urologic Disease - A Review of Contemporary Applications and Outcomes.,"PMC13332986 Case Report.
Title: Single Port Robotic Surgery in Benign Urologic Disease - A Review of Contemporary Applications and Outcomes.

Clinical Summary (from published abstract):
The advent of the Intuitive da Vinci single-port (SP) robotic system represents a pivotal evolution in minimally invasive urologic surgery, offering enhanced dexterity, improved surgical ergonomics, and reduced patient morbidity. This review is designed to provide a comprehensive evaluation of current literature regarding the feasibility, efficacy, cost considerations, and clinical applications of the SP platform across various benign urologic surgeries including pyeloplasty, ureteral reconstruction, donor nephrectomy, renal auto-transplantation, partial cystectomy, and simple prostatectomy. The review also analyzes current limitations of the robotic platform including a narrower range of available instruments, diminished instrument grip strength, and a steeper learning curve. Across these procedures, the SP system demonstrates comparable operative outcomes when compared to multi-port (MP) and open approaches. The SP system also has notable advantages in postoperative analgesia, incisional cosmesis, and hospital length of stay. The system’s low-profile design and ability to maintain an extraperitoneal approach confer distinct benefits in patients with complex surgical histories or hostile abdomens. Although the SP platform incurs higher disposable instrument costs, overall expenditures are mitigated with decreased hospital length of stay and reduced postoperative care requirements. As surgical experience and technological refinements progress, the SP robotic platform is anticipated to achieve broader integration in benign urology. Overall, SP robotic surgery offers a safe, effective, and patient-centered alternative to established minimally invasive techniques with the potential to further optimize perioperative outcomes and redefine the standard of care in contemporary urologic practice.",abstract,False,
PMC13332954,Myocarditis as the first sign of SLE: a case report and review of the literature.,"PMC13332954 Case Report.
Title: Myocarditis as the first sign of SLE: a case report and review of the literature.

Clinical Summary (from published abstract):
Lupus myocarditis (LM) is a rare but potentially life threatening manifestation of systemic lupus erythematous (SLE). LM may be rarely the initial presentation of SLE or ma y be presented during the course of the disease. Herein, we report a case of an adult female patient who presented with a 3-day history of abdominal pain, fever and recent onset dyspnea on exertion. Twenty-four hours later the patient developed acute heart failure went into cardiac arrest during her transfer from the internal medicine department to the CT scanner. She was intubated, an intra-aortic balloon pump was inserted, and was transferred to the intensive care unit (ICU). Based on clinical signs, laboratory parameters and cardiac imaging and after the exclusion of other causes of acute heart failure LM was diagnosed. The patient received high doses of corticosteroids and cyclophosphamide and she was improved. The vasopressors were tapered off and the intra-aortic balloon pump was removed. The patient improved and she shifted out of the ICU. The initially increased troponin levels were decreased, while the ejection fraction increased to 60% five days later. The patient was followed as an outpatient after hospital discharge. At 6 months of follow-up the she was on treatment with low doses of oral steroids, hydroxychloroquine and azathioprine and her ejection fraction is 73% without signs of active disease. No recurrences of her LM have been observed during her 32 month follow-up. Prompt recognition and aggressive immunosuppressive treatment may lead to favourable prognosis. The online version contains supplementary material available at 10.1007/s00296-026-06238-6.",abstract,True,
PMC13332949,Microthrombi and hypercoagulability's contribution to delayed cerebral ischemia after aneurysmal subarachnoid hemorrhage.,"PMC13332949 Case Report.
Title: Microthrombi and hypercoagulability's contribution to delayed cerebral ischemia after aneurysmal subarachnoid hemorrhage.

Clinical Summary (from published abstract):
Despite increasing knowledge over the last several decades of the factors contributing to delayed cerebral ischemia (DCI), it remains a significant cause of morbidity after aneurysmal subarachnoid hemorrhage (aSAH). The hypercoagulable state induced by aneurysm rupture is critical to most proposed mechanisms of DCI either through its direct contribution to microthrombi formation, or through the indirect effects of the products of coagulation on vasospasm, and inflammation. In this review we summarize clinical evidence of hypercoagulability after aSAH as well as both the clinical and pre-clinical evidence of its role in DCI, highlighting the role that microthrombi and NETosis are thought to play.",abstract,False,
PMC13333094,Corticosteroid-associated osteonecrosis in paediatric compared with adult patients: are they the same disease?,"PMC13333094 Case Report.
Title: Corticosteroid-associated osteonecrosis in paediatric compared with adult patients: are they the same disease?

Clinical Summary (from published abstract):
Osteonecrosis of the femoral head (ONFH) is a debilitating condition with a poorly characterized pathogenesis. Among the reported aetiologies, excessive alcohol consumption and corticosteroid administration are leading causes. Corticosteroids are often administered as a life-saving treatment for primary oncological or autoimmune conditions, but the subsequent development of ONFH can significantly impair the quality of life of both paediatric and adult patients. This review provides a comprehensive summary and critical analysis of recent advances in the understanding of corticosteroid-associated ONFH, with a focus on the distinctions between paediatric and adults patients. By elucidating age-dependent biological mechanisms and clinical characteristics, this work aims to enhance understanding of the disease’s pathogenesis. These insights may facilitate the development of improved strategies for early diagnosis and timely intervention, with the goal of preserving the functional and biomechanical integrity of the femoral head and improving patient outcomes across different ages. Cite this article: Bone Jt Open 2026;7(5):682–691.",abstract,False,
PMC13333066,Genetic screens of imaging-derived kidney volumes identify genes linked to kidney function.,"PMC13333066 Case Report.
Title: Genetic screens of imaging-derived kidney volumes identify genes linked to kidney function.

Clinical Summary (from published abstract):
Chronic kidney disease (CKD) is defined as sustained abnormalities in kidney function or structure. Genetic studies of CKD have largely focused on kidney function markers such as estimated glomerular filtration rate (eGFR). We hypothesized that genome-wide association studies (GWAS) of magnetic resonance imaging (MRI)-based kidney sub-volumes could provide insights into CKD risk genes complementary to the study of eGFR. Total kidney volume (TKV) and sub-volumes for cortex, medulla, and sinus were derived from abdominal MRIs of 38,816 United Kingdom Biobank participants of European ancestry using a trained convolutional neural network. GWAS was performed for body surface area-normalized kidney volumes and eGFR for comparison. Potentially causal genes at each locus were prioritized using a developed annotation pipeline. We assessed locus overlap between volumes, biomarker-based kidney function, and clinical traits using colocalization analyses. Annotated genes were further characterized through enrichment analyses, molecular and clinical annotations, including a screen for rare, putative loss-of-function variants. GWAS for 9,803,932 common genetic variants identified 34 significant loci for TKV, 24 for medulla, 26 for cortex, and 71 for sinus, compared to 32 for eGFR. Prioritized genes for cortex and medulla volumes showed corresponding tissue-specific expression and were enriched for kidney development- and hypoxia-related pathways. Genetic effect sizes of significant index single nucleotide polymorphisms for TKV, cortex, and medulla volumes correlated positively with those for eGFR. Some loci such as PKHD1 and BICC1 were strongly associated with kidney volumes but not eGFR. Integration with disease information revealed that rare, putative loss-of-function variants in BICC1, and common variants with regulatory potential, are associated with increased risk for CKD and dialysis, which was not identified in a previous GWAS of eGFR Our investigation shows that genetic findings of kidney structure can complement kidney function studies and reveal previously unrecognized CKD risk genes in the population. We performed a genetic analysis of kidney subvolumes, derived from whole body images of 38,816 participants of European ancestry in the UK Biobank. We aimed to uncover chronic kidney disease (CKD) risk genes that may be missed by traditional measures of kidney function, such as estimated glomerular filtration rate. This approach is a complementary approach to investigating the genetics of kidney disease and allowed us to detect genetic variants associated with kidney morphology in adults. For example, we identified genes related to kidney development and BICC1 as a CKD risk gene in the population. Future research integrating insights from imaging-derived measures of kidney structure may improve CKD risk stratification and enable research into molecular mechanisms relevant to kidney growth and repair.",abstract,False,
PMC13333232,Lecithin for dementia and cognitive impairment.,"PMC13333232 Case Report.
Title: Lecithin for dementia and cognitive impairment.

Clinical Summary (from published abstract):
Alzheimer's disease sufferers have been found to lack the enzyme responsible for converting choline into acetylcholine within the brain. Lecithin is a major dietary source of choline, so extra consumption may reduce the progression of dementia. To determine the efficacy of lecithin in the treatment of dementia or cognitive impairment. The Cochrane Dementia and Cognitive Improvement Group's Specialized Register was searched on 6 May 2004 using the terms lecithin and phosphatidylcholine. This register contains records from all major databases and many trials databases and is updated regularly. Reference lists and relevant books have been examined. All unconfounded, randomized trials comparing lecithin with placebo in a treatment period longer than one day, in patients with dementia of the Alzheimer type, vascular dementia, mixed vascular and Alzheimer's disease, unclassified or other dementia or unclassified cognitive impairment not fulfilling the criteria for dementia are eligible for inclusion. Data were extracted independently by two reviewers and cross‐checked. Meta‐analyses were performed when more than one trial provided data on a comparable outcome on sufficiently similar patients. Random effects analyses were performed whenever heterogeneity between results appeared to be present. Standardised differences in mean outcome measures were used due to the use of different scales and periods of treatment. Odds ratios for dichotomous data were pooled using the Mantel‐Haenszel or DerSimonian and Laird methods. Twelve randomized trials have been identified involving patients with Alzheimer's disease (265 patients), Parkinsonian dementia (21 patients) and subjective memory problems (90 patients). No trials reported any clear clinical benefit of lecithin for Alzheimer's disease or Parkinsonian dementia. Few trials contributed data to meta‐analyses. The only statistically significant result was in favour of placebo for adverse events, based on one trial, which appears likely to be a spurious result. A dramatic result in favour of lecithin was obtained in a trial of subjects with subjective memory problems. Evidence from randomized trials does not support the use of lecithin in the treatment of patients with dementia. A moderate effect cannot be ruled out, but results from the small trials to date do not indicate priority for a large randomized trial. Doubtful effect of lecithin as a treatment for dementia Lecithin is a major dietary source of choline, a substance that may theoretically improve brain functioning in people with dementia or similar problems (including Alzheimer's disease). This review did not find any evidence that lecithin does have a benefit for patients with Alzheimer's disease or other forms of dementia. However, one small study has observed a dramatic benefit of lecithin in people with subjective memory problems, but there are no similar studies with which to compare it.",abstract,False,
PMC13331987,Exercise-induced anaphylaxis with a cofactor of GIP/GLP-1 receptor agonist: A case report.,"PMC13331987 Case Report.
Title: Exercise-induced anaphylaxis with a cofactor of GIP/GLP-1 receptor agonist: A case report.

Clinical Summary (from published abstract):
We report a patient who developed exercise-induced anaphylaxis after starting the dual glucose-dependent insulinotropic polypeptide/glucagon-like peptide-1 receptor agonist tirzepatide, who after discontinuing tirzepatide, experienced resolution of exercise-induced anaphylaxis.",abstract,False,
PMC13332506,Reversible severe mitral regurgitation during immunotherapy in a structurally vulnerable valve: a case report.,"PMC13332506 Case Report.
Title: Reversible severe mitral regurgitation during immunotherapy in a structurally vulnerable valve: a case report.

Clinical Summary (from published abstract):
T-cell therapy (TCT) rarely causes isolated severe valvular pathology without cardiomyopathy, but its haemodynamic effects can exacerbate mitral regurgitation (MR) in patients with subtle valvular issues, and reports describing reversible valvular dysfunction in this context remain limited. A 48-year-old woman with a history of fenfluramine (FF) use for weight loss 10 years prior was diagnosed with B-cell acute lymphoblastic leukaemia (B-ALL). Baseline echocardiogram revealed trace MR. After her second blinatumomab (BL) cycle, she developed acute heart failure symptoms. Repeat echocardiogram showed severe MR with posterior leaflet restriction. Systemic inflammatory symptoms and end-organ damage were notably absent. BL was held, and medical therapy for heart failure with preserved ejection fraction (HFpEF) was initiated, improving MR and allowing resumption of BL. Baseline posterior mitral leaflet restriction was likely related to prior FF use. While BL carries a low cardiotoxicity profile, it can cause heart failure via cytokine release syndrome (CRS)-dependent and potentially CRS-independent pathways. In this case, we hypothesize that transient elevations in left-sided filling pressures, possibly from unmasking subtle diastolic dysfunction in a structurally vulnerable valve, amplified her MR. Delayed disclosure of FF use underscores the importance of intentional, non-judgmental history-taking. Recognition of this interaction guided haemodynamic optimization and enabled cautious, successful reinitiation of BL therapy. We emphasize considering prior FF use when evaluating patients with idiopathic MR. We also demonstrate how haemodynamic changes from TCT can worsen MR and show how careful haemodynamic management can enable the safe resumption of this lifesaving therapy.",abstract,False,
